{
  "capability_id": "dafny-proof-v1",
  "checker_id": "dafny",
  "version": "0.1.0",
  "implementation": "ovk-adapter-dafny",
  "input_contract": "Dafny proof-obligation contract payload for authorization/data/infra invariants.",
  "output_contract": "ovk.result.v1 with proof_failure counterexamples (deterministic evaluator today)",
  "claim_class": "proof_obligation",
  "tool": {
    "name": "dafny",
    "adapter": "ovk-adapter-dafny",
    "adapter_version": "0.1.0"
  },
  "backend_class": "proof_assistant",
  "input_languages": [
    "dafny"
  ],
  "supported_domains": [
    "authorization",
    "data_boundary",
    "infrastructure"
  ],
  "supported_property_kinds": [
    "invariant",
    "safety",
    "access_control"
  ],
  "guarantee": {
    "type": "proof_obligation",
    "meaning_of_pass": "Dafny verified the obligation.",
    "meaning_of_fail": "Dafny reported unproved obligations.",
    "meaning_of_unknown": "Dafny unavailable or obligation incomplete."
  },
  "assumptions": [
    "Specification matches intended behavior."
  ],
  "trusted_components": [
    "deterministic proof-obligation contract evaluator"
  ],
  "limits": [
    "Requires complete specifications."
  ],
  "failure_semantics": "Unavailable Dafny or incomplete obligation maps to unknown; evaluator errors map to error.",
  "timeout_semantics": "unknown",
  "timeout_behavior": "unknown",
  "unsupported_semantics": "Native Dafny verification is not implemented; requires complete specifications.",
  "determinism_status": "deterministic",
  "release_status": "experimental",
  "owner": "ovk-maintainers",
  "native_execution": false,
  "result_format": "ovk.result.v1",
  "counterexample_format": "proof_failure",
  "conformance": {
    "suite": "conformance/manifest.json"
  }
}
