{
  "capability_id": "lean-proof-v1",
  "checker_id": "lean",
  "version": "0.1.0",
  "implementation": "ovk-adapter-lean",
  "input_contract": "Lean theorem-obligation contract payload for authorization or agent-authority invariants.",
  "output_contract": "ovk.result.v1 with proof_failure counterexamples (deterministic evaluator today)",
  "claim_class": "proof_obligation",
  "tool": {
    "name": "lean",
    "adapter": "ovk-adapter-lean",
    "adapter_version": "0.1.0"
  },
  "backend_class": "proof_assistant",
  "input_languages": [
    "lean"
  ],
  "supported_domains": [
    "authorization",
    "agent_authority"
  ],
  "supported_property_kinds": [
    "invariant",
    "safety"
  ],
  "guarantee": {
    "type": "proof_obligation",
    "meaning_of_pass": "Lean proof completed without sorry.",
    "meaning_of_fail": "Lean reported proof obligations.",
    "meaning_of_unknown": "Lean unavailable or proof incomplete."
  },
  "assumptions": [
    "Formal model matches runtime policy."
  ],
  "trusted_components": [
    "deterministic theorem-obligation contract evaluator"
  ],
  "limits": [
    "Proof effort may exceed CI budgets."
  ],
  "failure_semantics": "Unavailable Lean or incomplete proof maps to unknown; evaluator errors map to error.",
  "timeout_semantics": "unknown",
  "timeout_behavior": "unknown",
  "unsupported_semantics": "Native Lean checking is not implemented; proof effort may exceed CI budgets.",
  "determinism_status": "deterministic",
  "release_status": "experimental",
  "owner": "ovk-maintainers",
  "native_execution": false,
  "result_format": "ovk.result.v1",
  "counterexample_format": "proof_failure",
  "conformance": {
    "suite": "conformance/manifest.json"
  }
}
